<?xml version="1.0" encoding="UTF-8"?>
<?xml-stylesheet type="text/css" href="estilos.css"?>
<?azomalli-sistema version="2.0" modulo="catalogo-digital" fecha="2026-10-07"?>

<!-- ======================================================================
     DOCUMENTO XML: Catálogo Oficial "Las Glorias de Azomalli"
     
     CUMPLIMIENTO DE REQUISITOS DEL PROYECTO (task.txt):
     1. Esquema DTD asociado: Azomalli.dtd
     2. Elementos: vacíos (<ambiente/>, <artesanal/>, <individual/>), de texto
        (#PCDATA), con sub-elementos, y de contenido mixto (<descripcion>).
     3. Atributos: CDATA, enumerados, #REQUIRED, #IMPLIED, #FIXED y con valor por defecto.
     4. Claves y referencias: ID (suc-matriz, cat-dulces, prod-concha, etc.),
        IDREF (categoriaRef, relacionado) e IDREFS (referencias en combo).
     5. Profundidad del documento >= 5:
        Nivel 1: CatalogoLasGloriasDeAzomalli
        Nivel 2: categorias
        Nivel 3: categoria
        Nivel 4: producto
        Nivel 5: informacionNutricional
        Nivel 6: valoresNutricionales
        Nivel 7: calorias  (Profundidad total = 7 niveles)
     6. Fan-out >= 8:
        El elemento <categoria id="cat-dulces"> contiene 18 sub-elementos <producto> directos.
        El elemento <categoria id="cat-salados"> contiene 12 sub-elementos <producto> directos.
     7. Entidades generales: &nombrePanaderia;, &ciudad;, &horarioAtencionMatriz;, &avisoLegal;
     8. Instrucciones de procesamiento: <?xml-stylesheet ...?> y <?azomalli-sistema ...?>
     9. Secciones CDATA: Incluidas en elementos <conservacion> con caracteres especiales (<, >, &).
     10. Comentarios: Explicativos a lo largo del documento.
     11. Datos de pan incorporados: Todos los 34 panes listados en pan.txt.
     ====================================================================== -->
<!DOCTYPE CatalogoLasGloriasDeAzomalli SYSTEM "Azomalli.dtd">

<CatalogoLasGloriasDeAzomalli version="1.0" fechaEmision="2026-10-07" sistema="AzomalliPOS-Enterprise">

    <!-- METADATOS Y CONTACTO (Uso de entidades generales) -->
    <metadatos>
        <titulo>Catálogo de Productos - &nombrePanaderia;</titulo>
        <descripcionEmpresa>Panadería, repostería fina y pan artesanal horneado diariamente en &ciudad;.</descripcionEmpresa>
        <contacto>
            <telefono>272-123-4567</telefono>
            <email>contacto@lasgloriasdeazomalli.mx</email>
            <horario>&horarioAtencionMatriz;</horario>
        </contacto>
        <avisoGeneral>&avisoLegal;</avisoGeneral>
    </metadatos>

    <!-- SUCURSAL (Clave ID y atributo enumerado con valor por defecto) -->
    <sucursal id="suc-matriz" zona="matriz">
        <nombreSucursal>Sucursal Central &nombrePanaderia;</nombreSucursal>
        <direccion>Av. Cri-Crí No. 540, Centro, &ciudad;</direccion>
        <telefonoSucursal>272-724-0011</telefonoSucursal>
    </sucursal>

    <!-- SECCIÓN DE CATEGORÍAS -->
    <categorias>

        <!-- ==================================================================
             CATEGORÍA 1: DULCES (FAN-OUT = 18 subelementos producto directos >= 8)
             ================================================================== -->
        <categoria id="cat-dulces" tipo="dulce" activa="si">
            <nombreCategoria>Pan Dulce Tradicional y Fino</nombreCategoria>
            <descripcionCategoria>Exquisita selección de panes dulces elaborados con mantequilla pura de vaca y recetas tradicionales mexicanas.</descripcionCategoria>

            <!-- 1. Concha -->
            <producto id="prod-concha" categoriaRef="cat-dulces" codigo="DUL-001" disponible="si" nivelDemanda="alta">
                <nombre>Concha</nombre>
                <descripcion>Clásica concha mexicana con esponjosa miga de vainilla y <destacado>costra azucarada crocante</destacado> horneada a la perfección.</descripcion>
                <precio moneda="MXN" ivaIncluido="si">14.00</precio>
                <detalle>
                    <especificaciones>
                        <pesoAprox>95g</pesoAprox>
                        <tiempoHorneado>18 minutos</tiempoHorneado>
                        <temperaturaConsumo><tibio/></temperaturaConsumo>
                    </especificaciones>
                    <ingredientes>
                        <ingrediente alergeno="si">Harina de trigo</ingrediente>
                        <ingrediente alergeno="si">Mantequilla de vaca</ingrediente>
                        <ingrediente alergeno="si">Huevo fresco</ingrediente>
                        <ingrediente alergeno="no">Azúcar morena</ingrediente>
                    </ingredientes>
                    <elaborado><artesanal hechoAMano="si"/></elaborado>
                </detalle>
                <presentacion>
                    <empaque><individual/></empaque>
                    <porciones>1 pieza</porciones>
                </presentacion>
                <informacionNutricional>
                    <porcNutricional>1 pieza (95g)</porcNutricional>
                    <valoresNutricionales>
                        <calorias>310 kcal</calorias>
                        <grasasTotales>11g</grasasTotales>
                        <azucares>16g</azucares>
                        <sodio>180mg</sodio>
                    </valoresNutricionales>
                </informacionNutricional>
                <conservacion><![CDATA[Conservar a temperatura ambiente < 24°C dentro de bolsa de papel. Evitar humedad > 65% & luz directa. Para disfrutar caliente, recalentar 2 min a 150°C.]]></conservacion>
            </producto>

            <!-- 2. Concha de Mantequilla -->
            <producto id="prod-concha-mantequilla" categoriaRef="cat-dulces" relacionado="prod-concha" codigo="DUL-002" disponible="si" nivelDemanda="alta">
                <nombre>Concha de Mantequilla</nombre>
                <descripcion>Versión premium con doble amasado y <destacado>100% mantequilla Gloria</destacado>, cubierta de pasta azucarada dorada.</descripcion>
                <precio moneda="MXN" ivaIncluido="si">18.00</precio>
                <detalle>
                    <especificaciones>
                        <pesoAprox>110g</pesoAprox>
                        <tiempoHorneado>20 minutos</tiempoHorneado>
                        <temperaturaConsumo><tibio/></temperaturaConsumo>
                    </especificaciones>
                    <ingredientes>
                        <ingrediente alergeno="si">Harina de trigo</ingrediente>
                        <ingrediente alergeno="si">Mantequilla artesanal</ingrediente>
                        <ingrediente alergeno="si">Huevo entero</ingrediente>
                        <ingrediente alergeno="no">Vainilla pura</ingrediente>
                    </ingredientes>
                    <elaborado><artesanal hechoAMano="si"/></elaborado>
                </detalle>
                <presentacion>
                    <empaque><individual/></empaque>
                    <porciones>1 pieza</porciones>
                </presentacion>
                <informacionNutricional>
                    <porcNutricional>1 pieza (110g)</porcNutricional>
                    <valoresNutricionales>
                        <calorias>360 kcal</calorias>
                        <grasasTotales>15g</grasasTotales>
                        <azucares>18g</azucares>
                        <sodio>190mg</sodio>
                    </valoresNutricionales>
                </informacionNutricional>
                <conservacion><![CDATA[Guardar en panera a temperatura ambiente (< 25°C). Mantener alejado de olores fuertes & humedad.]]></conservacion>
            </producto>

            <!-- 3. Mantecadas -->
            <producto id="prod-mantecadas" categoriaRef="cat-dulces" codigo="DUL-003" disponible="si" nivelDemanda="alta">
                <nombre>Mantecadas</nombre>
                <descripcion>Bizcocho suave y esponjoso horneado en capacillo rojo, con agradable <etiqueta>aroma a mantequilla y naranja</etiqueta>.</descripcion>
                <precio moneda="MXN" ivaIncluido="si">15.00</precio>
                <detalle>
                    <especificaciones>
                        <pesoAprox>85g</pesoAprox>
                        <tiempoHorneado>22 minutos</tiempoHorneado>
                        <temperaturaConsumo><ambiente/></temperaturaConsumo>
                    </especificaciones>
                    <ingredientes>
                        <ingrediente alergeno="si">Harina seleccionada</ingrediente>
                        <ingrediente alergeno="si">Mantequilla</ingrediente>
                        <ingrediente alergeno="si">Huevo</ingrediente>
                        <ingrediente alergeno="no">Ralladura de naranja</ingrediente>
                    </ingredientes>
                    <elaborado><artesanal hechoAMano="si"/></elaborado>
                </detalle>
                <presentacion>
                    <empaque><paquete/></empaque>
                    <porciones>2 piezas</porciones>
                </presentacion>
                <informacionNutricional>
                    <porcNutricional>1 pieza (85g)</porcNutricional>
                    <valoresNutricionales>
                        <calorias>290 kcal</calorias>
                        <grasasTotales>12g</grasasTotales>
                        <azucares>15g</azucares>
                        <sodio>140mg</sodio>
                    </valoresNutricionales>
                </informacionNutricional>
                <conservacion><![CDATA[Mantener dentro de su paquete sellado. Consumir dentro de las 72 horas posteriores a la compra.]]></conservacion>
            </producto>

            <!-- 4. Mantecadas de Nuez -->
            <producto id="prod-mantecadas-nuez" categoriaRef="cat-dulces" relacionado="prod-mantecadas" codigo="DUL-004" disponible="si" nivelDemanda="media">
                <nombre>Mantecadas de Nuez</nombre>